Publication Year,Author,Title,image,URL,LM,EM,DOI,analysis,proofreading,segmentation,acquisition,alignment,Executable,Dataset,Github,Publication Title
2010,"Peng, Hanchuan; Ruan, Zongcai; Long, Fuhui; Simpson, Julie H; Myers, Eugene W",V3D enables real-time 3D visualization and quantitative analysis of large-scale biological image data sets,V3D.png,,yes,yes,,Spatial-Exploration,,,,,no,no,no,Nature biotechnology
2015,"Eberle, A.L.; Mikula, S.; Schalek, R.; Lichtman, J.; Tate, M.L. Knothe; Zeidler, D.","High-resolution, high-throughput imaging with a multibeam scanning electron microscope.",multibeam15.png,https://onlinelibrary.wiley.com/doi/10.1111/jmi.12224,no,yes,10.1111/jmi.12224,,,,Nanoscale,,no,no,no,Journal of Microscopy
2018,"Eberle, Anna Lena; Zeidler, Dirk",Multi-Beam Scanning Electron Microscopy for High-Throughput Imaging in Connectomics Research,multibeam.png,https://www.frontiersin.org/article/10.3389/fnana.2018.00112/full,no,yes,10.3389/fnana.2018.00112,,,,Vis-for-Acquisition,,no,no,no,Frontiers in Neuroanatomy
2018,"Parag, Toufiq; Berger, Daniel; Kamentsky, Lee; Staffler, Benedikt; Wei, Donglai; Helmstaedter, Moritz; Lichtman, Jeff W.; Pfister, Hanspeter",Detecting Synapse Location and Connectivity by Signed Proximity Estimation and Pruning with Deep Nets,parag18.png,http://arxiv.org/abs/1807.02739,no,yes,,,,Automatic,,,no,no,no,arXiv:1807.02739 [cs]
2005,"Bussolati, G.; Marchiò, Caterina; Volante, M.",Tissue arrays as fiducial markers for section alignment in 3‐D reconstruction technology,tissue_arrays.png,https://www.ncbi.nlm.nih.gov/pmc/articles/PMC6740281/,no,no,10.1111/j.1582-4934.2005.tb00368.x,,,,,3D-Registration,no,no,no,Journal of Cellular and Molecular Medicine
2017,"Matejek, Brian; Haehn, Daniel; Lekschas, Fritz; Mitzenmacher, Michael; Pfister, Hanspeter",Compresso: Efficient compression of segmentation data for connectomics,compresso.png,,no,yes,,Data-Structures,,,,,no,no,no,International Conference on Medical Image Computing and Computer-Assisted Intervention
2015,"Papadopoulos, Charilaos; Petkov, Kaloian; Kaufman, Arie E.; Mueller, Klaus",The Reality Deck–an Immersive Gigapixel Display,reality_deck.png,,no,no,10.1109/MCG.2014.80,Spatial-Exploration,,Interactive,,,no,no,no,IEEE Computer Graphics and Applications
2002,"De Floriani, Leila; Magillo, Paola",Multiresolution mesh representation: Models and data structures,defloriani.png,,no,no,,Data-Structures,,,,,no,no,no,Tutorials on Multiresolution in Geometric Modelling
2022,"Galligan, Frank; Hemmer, Michael; Stava, Ondrej; Zhang, Fang; Brettle, Jamieson",Google/draco: a library for compressing and decompressing 3d geometric meshes and point clouds,draco.png,https://github.com/google/draco,no,no,,Data-Structures,,,,,no,no,no,
2019,"Berg, Stuart; Kutra, Dominik; Kroeger, Thorben; Straehle, Christoph N; Kausler, Bernhard X; Haubold, Carsten; Schiegg, Martin; Ales, Janez; Beier, Thorsten; Rudy, Markus; others",Ilastik: interactive machine learning for (bio) image analysis,ilastik.png,,no,no,,,,Interactive,,,no,no,yes,Nature Methods